{
  "$schema": "../../../../schemas/capability.schema.json",
  "schemaVersion": 2,
  "protocolVersion": "0.2",
  "id": "hairness/presentation",
  "owner": "hairness/presentation-controls",
  "version": "0.2.0-alpha.0",
  "summary": "Change the form of a result without inventing meaning or proof.",
  "operations": [
    { "id": "present", "class": "derive", "summary": "Choose the smallest sufficient set of views for an existing result.", "result": { "schema": "PresentationRequest", "disposition": "response" }, "sources": [], "effects": [], "routes": ["inline"], "acceptsModifiers": ["hairness.presentation"] }
  ]
}
