{
  "$schema": "../../../../schemas/capability.schema.json",
  "schemaVersion": 2,
  "protocolVersion": "0.2",
  "id": "hairness/work",
  "owner": "hairness/work-controls",
  "version": "0.2.0-alpha.0",
  "summary": "Keep human and agent aligned on active work, boundaries and next operations.",
  "operations": [
    {
      "id": "inspect",
      "class": "observe",
      "summary": "Inspect or resume the persistent work graph.",
      "sources": [],
      "effects": [],
      "routes": [
        "deterministic"
      ],
      "acceptsModifiers": [],
      "results": [
        {
          "id": "default",
          "contract": {
            "schema": "WorkState",
            "disposition": "run-only"
          }
        },
        {
          "id": "dashboard",
          "contract": {
            "schema": "ContextPacket",
            "disposition": "response"
          }
        }
      ],
      "defaultResult": "default"
    },
    {
      "id": "open-frame",
      "class": "effect",
      "summary": "Open one bounded frame in the active work segment.",
      "sources": [],
      "effects": [
        "hairness-state:write"
      ],
      "routes": [
        "deterministic"
      ],
      "acceptsModifiers": [],
      "results": [
        {
          "id": "default",
          "contract": {
            "schema": "ChangeReceipt",
            "disposition": "effect"
          }
        }
      ],
      "defaultResult": "default"
    },
    {
      "id": "discuss",
      "class": "derive",
      "summary": "Discuss one bounded frame without effects.",
      "sources": [],
      "effects": [],
      "routes": [
        "inline",
        "worker"
      ],
      "acceptsModifiers": [
        "hairness.presentation"
      ],
      "results": [
        {
          "id": "default",
          "contract": {
            "schema": "ContextPacket",
            "disposition": "response"
          }
        }
      ],
      "defaultResult": "default"
    },
    {
      "id": "recap",
      "class": "derive",
      "summary": "Reduce active work into a typed segment digest.",
      "sources": [],
      "effects": [],
      "routes": [
        "inline",
        "worker"
      ],
      "acceptsModifiers": [
        "hairness.presentation"
      ],
      "results": [
        {
          "id": "response",
          "contract": {
            "schema": "ContextPacket",
            "disposition": "response",
            "promotableTo": {
              "artifactOwner": "hairness/work-controls",
              "artifactType": "segment-digest"
            }
          }
        },
        {
          "id": "artifact",
          "contract": {
            "schema": "ArtifactEnvelope",
            "disposition": "artifact",
            "artifactOwner": "hairness/work-controls",
            "artifactType": "segment-digest"
          }
        }
      ],
      "defaultResult": "response"
    },
    {
      "id": "plan",
      "class": "derive",
      "summary": "Turn accepted decisions into a typed work plan.",
      "sources": [],
      "effects": [],
      "routes": [
        "inline",
        "worker"
      ],
      "acceptsModifiers": [
        "hairness.presentation"
      ],
      "results": [
        {
          "id": "response",
          "contract": {
            "schema": "ContextPacket",
            "disposition": "response",
            "promotableTo": {
              "artifactOwner": "hairness/work-controls",
              "artifactType": "work-plan"
            }
          }
        },
        {
          "id": "artifact",
          "contract": {
            "schema": "ArtifactEnvelope",
            "disposition": "artifact",
            "artifactOwner": "hairness/work-controls",
            "artifactType": "work-plan"
          }
        }
      ],
      "defaultResult": "response"
    },
    {
      "id": "act",
      "class": "effect",
      "summary": "Act on one accepted frame through an explicit checkpoint.",
      "sources": [],
      "effects": [
        "target-mutation"
      ],
      "routes": [
        "worker",
        "external"
      ],
      "acceptsModifiers": [],
      "results": [
        {
          "id": "default",
          "contract": {
            "schema": "ChangeReceipt",
            "disposition": "effect"
          }
        }
      ],
      "defaultResult": "default"
    },
    {
      "id": "execute",
      "class": "effect",
      "summary": "Execute one accepted WorkPlan through bounded routes.",
      "sources": [],
      "effects": [
        "target-mutation"
      ],
      "routes": [
        "worker",
        "external"
      ],
      "acceptsModifiers": [],
      "results": [
        {
          "id": "default",
          "contract": {
            "schema": "ContextPacket",
            "disposition": "effect"
          }
        }
      ],
      "defaultResult": "default"
    }
  ]
}
