{
  "$schema": "../../../../schemas/capability.schema.json",
  "schemaVersion": 2,
  "protocolVersion": "0.2",
  "id": "hairness/constraints",
  "owner": "hairness/constraints",
  "version": "0.2.0-alpha.0",
  "summary": "Inspect and explicitly tighten inherited operation boundaries.",
  "operations": [
    {
      "id": "inspect",
      "class": "observe",
      "summary": "Inspect effective constraints for the active scope.",
      "sources": [],
      "effects": [],
      "routes": [
        "deterministic"
      ],
      "acceptsModifiers": [],
      "results": [
        {
          "id": "default",
          "contract": {
            "schema": "Boundary",
            "disposition": "run-only"
          }
        }
      ],
      "defaultResult": "default"
    },
    {
      "id": "set",
      "class": "effect",
      "summary": "Tighten one constraint at an explicit scope.",
      "sources": [],
      "effects": [
        "constraint-state"
      ],
      "routes": [
        "deterministic"
      ],
      "acceptsModifiers": [],
      "results": [
        {
          "id": "default",
          "contract": {
            "schema": "Boundary",
            "disposition": "effect"
          }
        }
      ],
      "defaultResult": "default"
    },
    {
      "id": "clear",
      "class": "effect",
      "summary": "Clear one constraint at its owning scope.",
      "sources": [],
      "effects": [
        "constraint-state"
      ],
      "routes": [
        "deterministic"
      ],
      "acceptsModifiers": [],
      "results": [
        {
          "id": "default",
          "contract": {
            "schema": "Boundary",
            "disposition": "effect"
          }
        }
      ],
      "defaultResult": "default"
    }
  ]
}
