{
  "$schema": "../../../../schemas/capability.schema.json",
  "schemaVersion": 2,
  "protocolVersion": "0.2",
  "id": "hairness/understanding",
  "owner": "hairness/understanding-controls",
  "version": "0.2.0-alpha.0",
  "summary": "Make structures, concepts and alternatives understandable without inventing proof.",
  "operations": [
    {
      "id": "map",
      "class": "derive",
      "summary": "Organize the relevant relationships for one focus.",
      "inputSchema": "./schemas/understanding-input.schema.json",
      "sources": [],
      "effects": [],
      "routes": [
        "inline",
        "worker"
      ],
      "acceptsModifiers": [
        "hairness.presentation"
      ],
      "results": [
        {
          "id": "default",
          "contract": {
            "schema": "ContextPacket",
            "disposition": "response"
          }
        }
      ],
      "defaultResult": "default"
    },
    {
      "id": "explain",
      "class": "derive",
      "summary": "Clarify one concept from available meaning and proof.",
      "inputSchema": "./schemas/understanding-input.schema.json",
      "sources": [],
      "effects": [],
      "routes": [
        "inline",
        "worker"
      ],
      "acceptsModifiers": [
        "hairness.presentation"
      ],
      "results": [
        {
          "id": "default",
          "contract": {
            "schema": "ContextPacket",
            "disposition": "response"
          }
        }
      ],
      "defaultResult": "default"
    },
    {
      "id": "compare",
      "class": "derive",
      "summary": "Put explicit alternatives and tradeoffs in tension.",
      "inputSchema": "./schemas/understanding-input.schema.json",
      "sources": [],
      "effects": [],
      "routes": [
        "inline",
        "worker"
      ],
      "acceptsModifiers": [
        "hairness.presentation"
      ],
      "results": [
        {
          "id": "default",
          "contract": {
            "schema": "ContextPacket",
            "disposition": "response"
          }
        }
      ],
      "defaultResult": "default"
    }
  ]
}
